{
  "skillpack_id": "finn-finance-manager",
  "name": "Finn Finance Manager",
  "agent_name": "Finn",
  "channel": "internal_frontend",
  "version": "3.0.0",
  "description": "Strategic finance manager — snapshots, exceptions, proposals, A2A delegation, tax strategy.",
  "capabilities": [
    "can_read_finance_snapshot",
    "can_read_finance_exceptions",
    "can_draft_finance_packet",
    "can_create_finance_proposal",
    "can_delegate_to_agents"
  ],
  "risk_profile": {
    "default_risk_tier": "yellow",
    "max_risk_tier": "yellow"
  },
  "tools": [
    "finance.snapshot.read",
    "finance.exceptions.read",
    "finance.packet.draft",
    "finance.proposal.create",
    "a2a.dispatch"
  ],
  "providers": ["internal"],
  "actions": [
    "finance.snapshot.read", "finance.exceptions.read",
    "finance.packet.draft", "finance.proposal.create", "a2a.create"
  ],
  "certification_status": "uncertified",
  "outputs": ["finance_snapshot", "exception_report", "finance_packet", "finance_proposal"],
  "dependencies": []
}
