{
  "skillpack_id": "eli-inbox",
  "name": "Eli Inbox",
  "agent_name": "Eli",
  "channel": "internal_frontend",
  "version": "3.0.0",
  "description": "Email triage, drafting, and sending via PolarisM white-label email. YELLOW tier for sends.",
  "capabilities": [
    "can_triage_email",
    "can_draft_email",
    "can_send_email",
    "can_generate_digest"
  ],
  "risk_profile": {
    "default_risk_tier": "yellow",
    "max_risk_tier": "yellow"
  },
  "tools": [
    "polaris.email.read",
    "polaris.email.draft",
    "polaris.email.send",
    "internal.email.triage"
  ],
  "providers": ["polaris_email"],
  "actions": ["email.read", "email.triage", "email.draft", "email.send"],
  "certification_status": "uncertified",
  "outputs": ["email_draft", "triage_classification", "inbox_digest"],
  "dependencies": []
}
